Term ID	Label	Parent Term	Definition	GECKO Category	Internal ID	Suggested Categories	Comment
CANPATH:0000635	Biological mother's ethnic background  is Aboriginal (e.g. First Nations, Metis, Inuit).		Mother's ethnic background  - Aboriginal	ethnicity/race	SDC_EB_ABORIGINAL_M		
CANPATH:0000636	Biological mother's ethnic background  is Arab (e.g. Egypt, Iraq, Jordan, Lebanon).		Mother's ethnic background  - Arab	ethnicity/race	SDC_EB_ARAB_M		
CANPATH:0000637	Biological mother's ethnic background  is Black (African or Caribean descent).		Mother's ethnic background  - Black	ethnicity/race	SDC_EB_BLACK_M		
CANPATH:0000638	Biological mother's ethnic background  is East Asian (e.g. China, Japan, Korea, Taiwan).		Mother's ethnic background - East Asian	ethnicity/race	SDC_EB_E_ASIAN_M		
CANPATH:0000639	Biological mother's ethnic background  is Filipino.		Mother's ethnic background - Filipino	ethnicity/race	SDC_EB_FILIPINO_M		
CANPATH:0000640	Biological mother's ethnic background  is Jewish.		Mother's ethnic background - Jewish	ethnicity/race	SDC_EB_JEWISH_M		
CANPATH:0000641	Biological mother's ethnic background  is Latin American/Hispanic).		Mother's ethnic background - Latin American/Hispanic	ethnicity/race	SDC_EB_LATIN_M		
CANPATH:0000642	Biological mother's ethnic background  is South Asian (e.g. India, Sri Lanka, Pakistan, Bangladesh).		Mother's ethnic background - South Asian	ethnicity/race	SDC_EB_S_ASIAN_M		
CANPATH:0000643	Biological mother's ethnic background  is Southeast Asian (e.g. Malaysia, Indonesia, Viet Nam).		Mother's ethnic background - Southeast Asian	ethnicity/race	SDC_EB_SE_ASIAN_M		
CANPATH:0000644	Biological mother's ethnic background  is West Asian (e.g. Turkey, Iran, Afghanistan).		Mother's ethnic background - West Asian	ethnicity/race	SDC_EB_W_ASIAN_M		
CANPATH:0000645	Biological mother's ethnic background  is White (European descent).		Mother's ethnic background - White	ethnicity/race	SDC_EB_WHITE_M		
CANPATH:0000646	Biological mother has another ethnic background.		Mother's ethnic background - Other	ethnicity/race	SDC_EB_OTHER_M		
CANPATH:0000647	Biological father's ethnic background  is Aboriginal (e.g. First Nations, Metis, Inuit).		Father's ethnic background - Aboriginal	ethnicity/race	SDC_EB_ABORIGINAL_F		
CANPATH:0000648	Biological father's ethnic background  is Arab (e.g. Egypt, Iraq, Jordan, Lebanon).		Father's ethnic background - Arab	ethnicity/race	SDC_EB_ARAB_F		
CANPATH:0000649	Biological father's ethnic background  is Black (African or Caribean descent).		Father's ethnic background - Black	ethnicity/race	SDC_EB_BLACK_F		
CANPATH:0000650	Biological father's ethnic background  is East Asian (e.g. China, Japan, Korea, Taiwan).		Father's ethnic background - East Asian	ethnicity/race	SDC_EB_E_ASIAN_F		
CANPATH:0000651	Biological father's ethnic background  is Filipino.		Father's ethnic background  - Filipino	ethnicity/race	SDC_EB_FILIPINO_F		
CANPATH:0000652	Biological father's ethnic background  is Jewish.		Father's ethnic background - Jewish	ethnicity/race	SDC_EB_JEWISH_F		
CANPATH:0000653	Biological father's ethnic background  is Latin American/Hispanic).		Father's ethnic background - Latin American/Hispanic	ethnicity/race	SDC_EB_LATIN_F		
CANPATH:0000654	Biological father's ethnic background  is South Asian (e.g. India, Sri Lanka, Pakistan, Bangladesh).		Father's ethnic background - South Asian	ethnicity/race	SDC_EB_S_ASIAN_F		
CANPATH:0000655	Biological father's ethnic background  is Southeast Asian (e.g. Malaysia, Indonesia, Viet Nam).		Father's ethnic background - Southeast Asian	ethnicity/race	SDC_EB_SE_ASIAN_F		
CANPATH:0000656	Biological father's ethnic background  is West Asian (e.g. Turkey, Iran, Afghanistan).		Father's ethnic background - West Asian	ethnicity/race	SDC_EB_W_ASIAN_F		
CANPATH:0000657	Biological father's ethnic background  is White (European descent).		Father's ethnic background - White	ethnicity/race	SDC_EB_WHITE_F		
CANPATH:0000658	Biological mother has another ethnic background.		Father's ethnic background - Other	ethnicity/race	SDC_EB_OTHER_F		
CANPATH:0000659	Participant's country of birth		Country where the participant was born.	socio-demographic and economic characteristics	SDC_BIRTH_COUNTRY		
CANPATH:0000660	Participant's country of birth, other specify		Name of other country where the participant was born.	socio-demographic and economic characteristics	SDC_BIRTH_COUNTRY_OTSP		
CANPATH:0000661	Mother's country of birth		Country where the participant's biological mother was born.	socio-demographic and economic characteristics	SDC_BIRTH_COUNTRY_M		
CANPATH:0000662	Mother's country of birth, other specify		Name of other country where the participant's biological mother was born.	socio-demographic and economic characteristics	SDC_BIRTH_COUNTRY_M_OTSP		
CANPATH:0000663	Father's country of birth		Country where the participant's biological father was born.	socio-demographic and economic characteristics	SDC_BIRTH_COUNTRY_F		
CANPATH:0000664	Father's country of birth, other specify		Name of other country where the participant's biological father was born.	socio-demographic and economic characteristics	SDC_BIRTH_COUNTRY_F_OTSP		
CANPATH:0000665	Maternal grandmother's country of birth		Country where the participant's biological maternal grandmother was born.	socio-demographic and economic characteristics	SDC_BIRTH_COUNTRY_MM		
CANPATH:0000666	Maternal grandmother's country of birth, other specify		Name of other country where the participant's biological maternal grandmother was born.	socio-demographic and economic characteristics	SDC_BIRTH_COUNTRY_MM_OTSP		
CANPATH:0000667	Maternal grandfather's country of birth		Country where the participant's biological maternal grandfather was born.	socio-demographic and economic characteristics	SDC_BIRTH_COUNTRY_MF		
CANPATH:0000668	Maternal grandfather's country of birth, other specify		Name of other country where the participant's biological maternal grandfather was born.	socio-demographic and economic characteristics	SDC_BIRTH_COUNTRY_MF_OTSP		
CANPATH:0000669	Paternal grandmother's country of birth		Country where the participant's biological paternal grandmother was born.	socio-demographic and economic characteristics	SDC_BIRTH_COUNTRY_FM		
CANPATH:0000670	Paternal grandmother's country of birth, other specify		Name of other country where the participant's biological paternal grandmother was born.	socio-demographic and economic characteristics	SDC_BIRTH_COUNTRY_FM_OTSP		
CANPATH:0000671	Paternal grandfather's country of birth		Country where the participant's biological paternal grandfather was born.	socio-demographic and economic characteristics	SDC_BIRTH_COUNTRY_FF		
CANPATH:0000672	Paternal grandfather's country of birth, other specify		Name of other country where the participant's biological paternal grandfather was born.	socio-demographic and economic characteristics	SDC_BIRTH_COUNTRY_FF_OTSP		
CANPATH:0000673	Age of arrival in Canada		Age of the participant when he first came to live in Canada.	life stage/time point	SDC_ARRIVAL_AGE		
CANPATH:0000674	Language first learned - English		Indicator of whether English is the participant's first language learned at home and he/she still understands it.	native language	SDC_LANG_ENGLISH		
CANPATH:0000675	Language first learned - French		Indicator of whether French is the participant's first language learned at home and he/she still understands it.	native language	SDC_LANG_FRENCH		
CANPATH:0000676	Language first learned - Arabic		Indicator of whether Arabic is the participant's first language learned at home and he/she still understands it.	native language	SDC_LANG_ARABIC		
CANPATH:0000677	Language first learned - Aboriginal language(s)		Indicator of whether Aboriginal is the participant's first language learned at home and he/she still understands it.	native language	SDC_LANG_ABORIGINAL		
CANPATH:0000678	Language first learned - Bengali		Indicator of whether Bengali is the participant's first language learned at home and he/she still understands it.	native language	SDC_LANG_BENGALI		
CANPATH:0000679	Language first learned - Cantonese		Indicator of whether Cantonese is the participant's first language learned at home and he/she still understands it.	native language	SDC_LANG_CANTONESE		
CANPATH:0000680	Language first learned - Danish		Indicator of whether Danish is the participant's first language learned at home and he/she still understands it.	native language	SDC_LANG_DANISH		
CANPATH:0000681	Language first learned - Dutch		Indicator of whether Dutch is the participant's first language learned at home and he/she still understands it.	native language	SDC_LANG_DUTCH		
CANPATH:0000682	Language first learned - Farsi/Persian		Indicator of whether Farsi/Persian is the participant's first language learned at home and he/she still understands it.	native language	SDC_LANG_FARSI_PERSIAN		
CANPATH:0000683	Language first learned - Tagalog/Filipino		Indicator of whether Tagalog/Filipino is the participant's first language learned at home and he/she still understands it.	native language	SDC_LANG_TAGALOG_FILIPINO		
CANPATH:0000684	Language first learned - Finnish		Indicator of whether Finnish is the participant's first language learned at home and he/she still understands it.	native language	SDC_LANG_FINNISH		
CANPATH:0000685	Language first learned - Gaelic		Indicator of whether Gaelic is the participant's first language learned at home and he/she still understands it.	native language	SDC_LANG_GAELIC		
CANPATH:0000686	Language first learned - German		Indicator of whether German is the participant's first language learned at home and he/she still understands it.	native language	SDC_LANG_GERMAN		
CANPATH:0000687	Language first learned - Greek		Indicator of whether Greek is the participant's first language learned at home and he/she still understands it.	native language	SDC_LANG_GREEK		
CANPATH:0000688	Language first learned - Hindi		Indicator of whether Hindi is the participant's first language learned at home and he/she still understands it.	native language	SDC_LANG_HINDI		
CANPATH:0000689	Language first learned - Hungarian		Indicator of whether Hungarian is the participant's first language learned at home and he/she still understands it.	native language	SDC_LANG_HUNGARIAN		
CANPATH:0000690	Language first learned - Icelandic		Indicator of whether Icelandic is the participant's first language learned at home and he/she still understands it.	native language	SDC_LANG_ICELANDIC		
CANPATH:0000691	Language first learned - Italian		Indicator of whether Italian is the participant's first language learned at home and he/she still understands it.	native language	SDC_LANG_ITALIAN		
CANPATH:0000692	Language first learned - Korean		Indicator of whether Korean is the participant's first language learned at home and he/she still understands it.	native language	SDC_LANG_KOREAN		
CANPATH:0000693	Language first learned - Mandarin		Indicator of whether Mandarin is the participant's first language learned at home and he/she still understands it.	native language	SDC_LANG_MANDARIN		
CANPATH:0000694	Language first learned - Norwegian		Indicator of whether Norwegian is the participant's first language learned at home and he/she still understands it.	native language	SDC_LANG_NORWEGIAN		
CANPATH:0000695	Language first learned - Polish		Indicator of whether Polish is the participant's first language learned at home and he/she still understands it.	native language	SDC_LANG_POLISH		
CANPATH:0000696	Language first learned - Portuguese		Indicator of whether Portugese is the participant's first language learned at home and he/she still understands it.	native language	SDC_LANG_PORTUGESE		
CANPATH:0000697	Language first learned - Punjabi		Indicator of whether Punjabi is the participant's first language learned at home and he/she still understands it.	native language	SDC_LANG_PUNJABI		
CANPATH:0000698	Language first learned - Russian		Indicator of whether Russian is the participant's first language learned at home and he/she still understands it.	native language	SDC_LANG_RUSSIAN		
CANPATH:0000699	Language first learned - Spanish		Indicator of whether Spanish is the participant's first language learned at home and he/she still understands it.	native language	SDC_LANG_SPANISH		
CANPATH:0000700	Language first learned - Swedish		Indicator of whether Swedish is the participant's first language learned at home and he/she still understands it.	native language	SDC_LANG_SWEDISH		
CANPATH:0000701	Language first learned - Tamil		Indicator of whether Tamil is the participant's first language learned at home and he/she still understands it.	native language	SDC_LANG_TAMIL		
CANPATH:0000702	Language first learned - Ukrainian		Indicator of whether Ukrainian is the participant's first language learned at home and he/she still understands it.	native language	SDC_LANG_UKRAINIAN		
CANPATH:0000703	Language first learned - Urdu		Indicator of whether Urdu is the participant's first language learned at home and he/she still understands it.	native language	SDC_LANG_URDU		
CANPATH:0000704	Language first learned - Vietnamese		Indicator of whether Vietnamese is the participant's first language learned at home and he/she still understands it.	native language	SDC_LANG_VIETNAMESE		
CANPATH:0000705	Language first learned - Welsh		Indicator of whether Welsh is the participant's first language learned at home and he/she still understands it.	native language	SDC_LANG_WELSH		
CANPATH:0000706	Language first learned - Other		Indicator of whether the participant's first learned at home an other language than those listed and he/she still understands it.	native language	SDC_LANG_OTHER		
CANPATH:0000707	Language first learned, Other specify		Name of other language(s) first learned at home that the participant still understands.	native language	SDC_LANG_OTSP		
CANPATH:0000708	Full-time employed		"Indicator of whether the participant is currently employed full-time (paid employment or self-employed). 



Full time means 30 hours or more per week."	occupation	WRK_FULL_TIME		
CANPATH:0000709	Part-time employed		"Indicator of whether the participant is currently employed part-time (paid employment or self-employed). 



Part time means less than 30 hours per week."	occupation	WRK_PART_TIME		
CANPATH:0000710	Retired		Indicator of whether the participant is currently retired.	occupation	WRK_RETIREMENT		
CANPATH:0000711	Looking after home/family		Indicator of whether the participant is currently looking after a home and/or a family.	occupation	WRK_HOME_FAMILY		
CANPATH:0000712	Unable to work		Indicator of whether the participant is currently unable to work because of sickness or disability.	occupation	WRK_UNABLE		
CANPATH:0000713	Unemployed		Indicator of whether the participant is currently unemployed.	occupation	WRK_UNEMPLOYED		
CANPATH:0000714	Doing unpaid work		Indicator of whether the participant is currently doing unpaid or voluntary work.	occupation	WRK_UNPAID		
CANPATH:0000715	Student		Indicator of whether the participant is currently a student.	occupation	WRK_STUDENT		
CANPATH:0000716	Employment status		Indicator of whether the participant currently has paid employment or is self-employed (including full-time and part time status).	socio-demographic and economic characteristics	WRK_EMPLOYMENT		
CANPATH:0000717	Current type of industry - categorical		Type of industry in which the participant currently works - specified categories.	occupation	WRK_IND_TYPE_CUR_CAT		
CANPATH:0000718	Current type of industry, other specify		Name of other type of industry in which the participant currently works.	occupation	WRK_IND_TYPE_CUR_CAT_OTSP		
CANPATH:0000719	Current type of industry - open text		Type of industry in which the participant currently works - open text.	occupation	WRK_IND_TYPE_CUR_OPEN		
CANPATH:0000720	Current type of job - categorical		Participant's current job type - specified categories.	occupation	WRK_JOB_TYPE_CUR_CAT		
CANPATH:0000721	Current type of job, other specify		Name of other participant's current job type.	occupation	WRK_JOB_TYPE_CUR_CAT_OTSP		
CANPATH:0000722	Current job title - open text		Participant's current job title - open text.	occupation	WRK_JOB_TITLE_CUR_OPEN		
CANPATH:0000723	Age started current job		Age at which the participant started working at his current job.	occupation|life stage/time point	WRK_JOB_AGE_CUR		
CANPATH:0000724	Current working schedule		Working schedule of the participant at his current job.	occupation	WRK_SCHEDULE_CUR_CAT		
CANPATH:0000725	Current working schedule, other specify		Other working schedule of the participant at his current job.	occupation	WRK_SCHEDULE_CUR_OTSP		
CANPATH:0000726	Current occupation held for longest duration		Indicator of whether the current job of the participant is the one he held the longest.	occupation	WRK_JOB_CUR_LONGEST		
CANPATH:0000727	Type of industry for occupation of longest duration - categorical		Type of industry in which the participant worked for the longest duration - specified categories.	occupation	WRK_IND_TYPE_LONGEST_CAT		
CANPATH:0000728	Type of industry for occupation of longest duration - open text		Type of industry in which the participant worked for the longest duration - open text.	occupation	WRK_IND_TYPE_LONGEST_OPEN		
CANPATH:0000729	Type of job held for longest duration - categorical		Participant's type of job held for longest period of time - specified categories.	occupation	WRK_JOB_TYPE_LONGEST_CAT		
CANPATH:0000730	Type of job held for longest duration, other specify		Name of other participant's type of job held for longest period of time.	occupation	WRK_JOB_TYPE_LONGEST_CAT_OTSP		
CANPATH:0000731	Job title for occupation of longest duration - open text		Participant's type of job held for longest period of time - open text.	occupation	WRK_JOB_TITLE_LONGEST_OPEN		
CANPATH:0000732	Working schedule for occupation held longest time		Working schedule of the participant at his job held for longest duration.	occupation	WRK_SCHEDULE_LONGEST_CAT		
CANPATH:0000733	Working schedule for occupation held longest time, other specify		Other working schedule of the participant at his job held for longest duration.	occupation	WRK_SCHEDULE_LONGEST_OTSP		
CANPATH:0000734	Age started job of longest duration		Age at which the participant started working at the job held for longest duration.	occupation|life stage/time point	WRK_JOB_LONGEST_AGE_START		
CANPATH:0000735	Age stopped job of longest duration		Age at which the participant stopped working at the job held for longest duration.	occupation|life stage/time point	WRK_JOB_LONGEST_AGE_STOP		
CANPATH:0000736	Handedness		Dominant use or manifestations of one side of the body versus the other.		PM_HANDEDNESS		
CANPATH:0000737	Able to stand		Indicator of whether the participant is able to stand.	quality of life	PM_ABLE_STAND		
CANPATH:0000738	Average standing height - self reported		Average of the two vertical measurements or distance from the foot to the head of the participant when he/she is standing. Measure taken and reported by the participant.	height	PM_STAND_HEIGHT_SR_AVG		
CANPATH:0000739	Average weight - self-reported		Average of the two weight measurements. Measure taken and reported by the participant.	weight	PM_WEIGHT_SR_AVG		
CANPATH:0000740	Average hip circumference - self-reported		Average of the two hip circumference measurements. Measure taken and reported by the participant.	anthropometry	PM_HIP_SR_AVG		
CANPATH:0000741	Average waist circumference - self-reported		Average of the two waist circumference measurements. Measure taken and reported by the participant.	anthropometry	PM_WAIST_SR_AVG		
CANPATH:0000742	Waist to hip ratio - self-reported		Ratio calculated using waist and hip circumference measurements. Measure taken and reported by the participant.	anthropometry	PM_WAIST_HIP_RATIO_SR		
CANPATH:0000743	Body mass index - self-reported		"Weight (in kg) divided by height (in m) squared.

Body mass index = (Weight) / (Standing height * 0.01)^2

Measure taken and reported by the participant."	anthropometry	PM_BMI_SR		
CANPATH:0000744	Drug identification number (DIN) - medication 1		Drug identification number (DIN) of medication 1	medication	MD_DIN_1		
CANPATH:0000745	Name - medication 1		Name of medication 1	medication	MD_MED_1		
CANPATH:0000746	Drug code from the Drug Product Database (DPD) - medication 1		Drug code from the Drug Product Database (DPD) provided by Health Canada for medication 1	medication	MD_DRUG_CODE_1		
CANPATH:0000747	Brand name of medication from the Drug Product Database (DPD) - medication 1		Brand name of medication 1 provided by Health Canada	medication	MD_BRAND_1		
CANPATH:0000748	Anatomical Therapeutic Chemical (ATC) code (match) - medication 1		Anatomical Therapeutic Chemical (ATC) code of medication 1 when DIN or medication name missing or incorrect	medication	MD_ATC_MATCH_1		
CANPATH:0000749	Anatomical Therapeutic Chemical (ATC) code - medication 1		Anatomical Therapeutic Chemical (ATC) code of medication 1	medication	MD_ATC_CODE_1		
CANPATH:0000750	Chemical substance, 5th level of ATC classification - medication 1		Chemical substance of medication 1, 5th level of the ATC classification system	medication	MD_ATC_1		
CANPATH:0000751	Drug identification number (DIN) - medication 2		Drug identification number (DIN) of medication 2	medication	MD_DIN_2		
CANPATH:0000752	Name - medication 2		Name of medication 2	medication	MD_MED_2		
CANPATH:0000753	Drug code from the Drug Product Database (DPD) - medication 2		Drug code from the Drug Product Database (DPD) provided by Health Canada for medication 2	medication	MD_DRUG_CODE_2		
CANPATH:0000754	Brand name of medication from the Drug Product Database (DPD) - medication 2		Brand name of medication 2 provided by Health Canada	medication	MD_BRAND_2		
CANPATH:0000755	Anatomical Therapeutic Chemical (ATC) code (match) - medication 2		Anatomical Therapeutic Chemical (ATC) code of medication 2 when DIN or medication name missing or incorrect	medication	MD_ATC_MATCH_2		
CANPATH:0000756	Anatomical Therapeutic Chemical (ATC) code - medication 2		Anatomical Therapeutic Chemical (ATC) code of medication 2	medication	MD_ATC_CODE_2		
CANPATH:0000757	Chemical substance, 5th level of ATC classification - medication 2		Chemical substance of medication 2, 5th level of the ATC classification system	medication	MD_ATC_2		
CANPATH:0000758	Drug identification number (DIN) - medication 3		Drug identification number (DIN) of medication 3	medication	MD_DIN_3		
CANPATH:0000759	Name - medication 3		Name of medication 3	medication	MD_MED_3		
CANPATH:0000760	Drug code from the Drug Product Database (DPD) - medication 3		Drug code from the Drug Product Database (DPD) provided by Health Canada for medication 3	medication	MD_DRUG_CODE_3		
CANPATH:0000761	Brand name of medication from the Drug Product Database (DPD) - medication 3		Brand name of medication 3 provided by Health Canada	medication	MD_BRAND_3		
CANPATH:0000762	Anatomical Therapeutic Chemical (ATC) code (match) - medication 3		Anatomical Therapeutic Chemical (ATC) code of medication 3 when DIN or medication name missing or incorrect	medication	MD_ATC_MATCH_3		
CANPATH:0000763	Anatomical Therapeutic Chemical (ATC) code - medication 3		Anatomical Therapeutic Chemical (ATC) code of medication 3	medication	MD_ATC_CODE_3		
CANPATH:0000764	Chemical substance, 5th level of ATC classification - medication 3		Chemical substance of medication 3, 5th level of the ATC classification system	medication	MD_ATC_3		
CANPATH:0000765	Drug identification number (DIN) - medication 4		Drug identification number (DIN) of medication 4	medication	MD_DIN_4		
CANPATH:0000766	Name - medication 4		Name of medication 4	medication	MD_MED_4		
CANPATH:0000767	Drug code from the Drug Product Database (DPD) - medication 4		Drug code from the Drug Product Database (DPD) provided by Health Canada for medication 4	medication	MD_DRUG_CODE_4		
CANPATH:0000768	Brand name of medication from the Drug Product Database (DPD) - medication 4		Brand name of medication 4 provided by Health Canada	medication	MD_BRAND_4		
CANPATH:0000769	Anatomical Therapeutic Chemical (ATC) code (match) - medication 4		Anatomical Therapeutic Chemical (ATC) code of medication 4 when DIN or medication name missing or incorrect	medication	MD_ATC_MATCH_4		
CANPATH:0000770	Anatomical Therapeutic Chemical (ATC) code - medication 4		Anatomical Therapeutic Chemical (ATC) code of medication 4	medication	MD_ATC_CODE_4		
CANPATH:0000771	Chemical substance, 5th level of ATC classification - medication 4		Chemical substance of medication 4, 5th level of the ATC classification system	medication	MD_ATC_4		
CANPATH:0000772	Drug identification number (DIN) - medication 5		Drug identification number (DIN) of medication 5	medication	MD_DIN_5		
CANPATH:0000773	Name - medication 5		Name of medication 5	medication	MD_MED_5		
CANPATH:0000774	Drug code from the Drug Product Database (DPD) - medication 5		Drug code from the Drug Product Database (DPD) provided by Health Canada for medication 5	medication	MD_DRUG_CODE_5		
CANPATH:0000775	Brand name of medication from the Drug Product Database (DPD) - medication 5		Brand name of medication 5 provided by Health Canada	medication	MD_BRAND_5		
CANPATH:0000776	Anatomical Therapeutic Chemical (ATC) code (match) - medication 5		Anatomical Therapeutic Chemical (ATC) code of medication 5 when DIN or medication name missing or incorrect	medication	MD_ATC_MATCH_5		
CANPATH:0000777	Anatomical Therapeutic Chemical (ATC) code - medication 5		Anatomical Therapeutic Chemical (ATC) code of medication 5	medication	MD_ATC_CODE_5		
CANPATH:0000778	Chemical substance, 5th level of ATC classification - medication 5		Chemical substance of medication 5, 5th level of the ATC classification system	medication	MD_ATC_5		
CANPATH:0000779	Drug identification number (DIN) - medication 6		Drug identification number (DIN) of medication 6	medication	MD_DIN_6		
